id,h-id,topic
2976,3.12.1.6,Qualitative Analysis of First-Order ODEs
2023,3.12.1.7,Modeling With First-Order ODEs
602,3.12.2.1,Euler's Method: Calculating One Step
3668,3.12.2.2,Euler's Method: Calculating Multiple Steps
1166,3.13.1.1,Three-Dimensional Vectors in Component Form
175,3.13.1.2,Addition and Scalar Multiplication of Cartesian Vectors in 3D
1277,3.13.1.3,Calculating the Magnitude of Cartesian Vectors in 3D
243,3.13.2.1,Calculating the Dot Product Using Angle and Magnitude
177,3.13.2.2,Calculating the Dot Product Using Components
1278,3.13.2.3,The Angle Between Two Vectors
1285,3.13.2.4,Calculating a Scalar Projection
1295,3.13.2.5,Calculating a Vector Projection
246,3.13.3.1,The Cross Product of Two Vectors
4858,3.13.3.2,Properties of the Cross Product
245,3.13.3.3,Calculating the Cross Product Using Determinants
1299,3.13.3.4,Finding Areas Using the Cross Product
1286,3.13.3.5,The Scalar Triple Product
1287,3.13.3.6,Volumes of Parallelepipeds
475,3.13.4.1,Defining Vector-Valued Functions
4139,3.13.4.2,Differentiating Vector-Valued Functions
1085,3.13.4.3,Integrating Vector-Valued Functions
861,3.14.1.1,Introduction to Matrices
1167,3.14.1.2,Index Notation for Matrices
29,3.14.1.3,Adding and Subtracting Matrices
1168,3.14.1.4,Properties of Matrix Addition
146,3.14.1.5,Scalar Multiplication of Matrices
862,3.14.1.6,"Zero, Square, Diagonal and Identity Matrices"
232,3.14.1.7,The Transpose of a Matrix
1195,3.14.2.1,Multiplying a Matrix by a Column Vector
147,3.14.2.2,Multiplying Square Matrices
1198,3.14.2.3,Conformability for Matrix Multiplication
1196,3.14.2.4,Multiplying Matrices
1725,3.14.2.5,Powers of Matrices
1171,3.14.2.6,Multiplying a Matrix by the Identity Matrix
1724,3.14.2.7,Properties of Matrix Multiplication
1729,3.14.2.8,Representing 2x2 Systems of Equations Using a Matrix Product
155,3.14.2.9,Representing 3x3 Systems of Equations Using a Matrix Product
152,3.14.3.1,The Determinant of a 2x2 Matrix
1169,3.14.3.2,The Geometric Interpretation of the 2x2 Determinant
233,3.14.3.3,The Minors of a 3x3 Matrix
153,3.14.3.4,The Determinant of a 3x3 Matrix
863,3.14.4.1,Introduction to the Inverse of a Matrix
864,3.14.4.2,Inverses of 2x2 Matrices
154,3.14.4.3,Calculating the Inverse of a 3x3 Matrix Using the Cofactor Method
934,3.14.4.4,Solving 2x2 Systems of Equations Using Inverse Matrices
1023,3.14.4.5,Solving Systems of Equations Using Inverse Matrices
865,3.14.5.1,Introduction to Linear Transformations
1959,3.14.5.2,The Standard Matrix of a Linear Transformation
2706,3.14.5.3,Linear Transformations of Points and Lines in the Plane
866,3.14.5.4,Linear Transformations of Objects in the Plane
867,3.14.5.5,Dilations and Reflections as Linear Transformations
1358,3.14.5.6,Shear and Stretch as Linear Transformations
931,3.14.5.7,Right-Angle Rotations as Linear Transformations
932,3.14.5.8,Rotations as Linear Transformations
933,3.14.5.9,Combining Linear Transformations Using 2x2 Matrices
988,3.14.5.10,Inverting Linear Transformations
989,3.14.5.11,Area Scale Factors of Linear Transformations
1351,3.14.5.12,Singular Linear Transformations in the Plane
324,3.15.1.1,Conditional Probabilities From Venn Diagrams
715,3.15.1.2,The Multiplication Law for Conditional Probability
773,3.15.1.3,The Law of Total Probability
183,3.15.1.4,Independent Events
740,3.15.1.5,The Addition Law of Probability
4315,3.15.1.6,Applying the Addition Law With Event Complements
1154,3.15.1.7,Mutually Exclusive Events
1290,3.15.2.1,Probability Mass Functions of Discrete Random Variables
2024,3.15.2.2,Cumulative Distribution Functions for Discrete Random Variables
730,3.15.2.3,Expected Values of Discrete Random Variables
3281,3.15.2.4,The Binomial Distribution
1395,3.15.2.5,Modeling With the Binomial Distribution
3284,3.15.2.6,The Geometric Distribution
2839,3.15.2.7,Modeling With the Geometric Distribution
265,3.15.3.1,The Standard Normal Distribution
4420,3.15.3.2,Symmetry Properties of the Standard Normal Distribution
1843,3.15.3.3,The Normal Distribution
1470,3.15.3.4,Mean and Variance of the Normal Distribution
3214,3.15.3.5,Percentage Points of the Standard Normal Distribution
788,3.15.3.6,Modeling With the Normal Distribution
